{
  "$schema": "https://json-schema.org/draft/2020-12/schema",
  "$id": "https://ai-native-os.example/specs/execution-binding.schema.json",
  "title": "AIOS v0.1 Execution Binding",
  "description": "Immutable attempt-specific binding of one validated AIOS IR node to provider, inputs/outputs, authority, isolation, and placement. This is runtime state, not semantic IR.",
  "type": "object",
  "additionalProperties": false,
  "required": [
    "schema_version",
    "binding_id",
    "attempt_id",
    "task_id",
    "semantic_program_hash",
    "registry_snapshot_id",
    "ir_version",
    "node_id",
    "capability",
    "capability_contract_hash",
    "conformance_evidence_id",
    "provider_trust_source_id",
    "provider",
    "inputs",
    "outputs",
    "policy_decision_refs",
    "authority",
    "execution_profile",
    "placement",
    "attempt",
    "created_at"
  ],
  "properties": {
    "schema_version": {"type": "string", "const": "0.1"},
    "binding_id": {"type": "string", "minLength": 1, "maxLength": 256},
    "attempt_id": {"type": "string", "minLength": 1, "maxLength": 256},
    "task_id": {"type": "string", "minLength": 1, "maxLength": 256},
    "semantic_program_hash": {"type": "string", "pattern": "^sha256:[a-f0-9]{64}$"},
    "registry_snapshot_id": {"type": "string", "minLength": 1, "maxLength": 256},
    "ir_version": {"type": "string", "minLength": 1, "maxLength": 32},
    "node_id": {"type": "string", "minLength": 1, "maxLength": 128},
    "capability": {"type": "string", "pattern": "^[a-z][a-z0-9_.-]*@(?:0|[1-9][0-9]*)$"},
    "capability_contract_hash": {"type": "string", "pattern": "^sha256:[a-f0-9]{64}$"},
    "conformance_evidence_id": {"type": "string", "minLength": 1, "maxLength": 256},
    "provider_trust_source_id": {"type": "string", "minLength": 1, "maxLength": 256},
    "provider": {
      "type": "object",
      "additionalProperties": false,
      "required": ["id", "version", "manifest_hash", "package_or_build_hash"],
      "properties": {
        "id": {"type": "string", "minLength": 1, "maxLength": 256},
        "version": {"type": "string", "minLength": 1, "maxLength": 128},
        "manifest_hash": {"type": "string", "pattern": "^sha256:[a-f0-9]{64}$"},
        "package_or_build_hash": {"type": "string", "pattern": "^sha256:[a-f0-9]{64}$"},
        "conformance_status": {"type": ["string", "null"], "enum": [null, "declared", "tested", "certified"]}
      }
    },
    "inputs": {
      "type": "object",
      "propertyNames": {"pattern": "^[A-Za-z_][A-Za-z0-9_]*$"},
      "additionalProperties": {
        "type": "object",
        "additionalProperties": false,
        "required": ["semantic_type", "artifact_or_value_ref"],
        "properties": {
          "semantic_type": {"type": "string", "pattern": "^[a-z][a-z0-9_.-]*@(?:0|[1-9][0-9]*)$"},
          "artifact_or_value_ref": {"type": "string", "minLength": 1, "maxLength": 1024},
          "content_hash": {"type": ["string", "null"], "maxLength": 256},
          "revision": {"type": ["integer", "null"], "minimum": 0}
        }
      }
    },
    "outputs": {
      "type": "object",
      "propertyNames": {"pattern": "^[A-Za-z_][A-Za-z0-9_]*$"},
      "additionalProperties": {
        "type": "object",
        "additionalProperties": false,
        "required": ["semantic_type", "allocation_ref"],
        "properties": {
          "semantic_type": {"type": "string", "pattern": "^[a-z][a-z0-9_.-]*@(?:0|[1-9][0-9]*)$"},
          "allocation_ref": {"type": "string", "minLength": 1, "maxLength": 1024}
        }
      }
    },
    "policy_decision_refs": {
      "type": "array",
      "maxItems": 64,
      "uniqueItems": true,
      "items": {"type": "string", "minLength": 1, "maxLength": 256}
    },
    "authority": {
      "type": "object",
      "additionalProperties": false,
      "required": ["grant_refs"],
      "properties": {
        "grant_refs": {
          "type": "array",
          "maxItems": 64,
          "uniqueItems": true,
          "items": {"type": "string", "minLength": 1, "maxLength": 512}
        },
        "expires_at": {"type": ["string", "null"], "format": "date-time"}
      }
    },
    "external_export": {"$ref":"#/$defs/exactExport"},
    "execution_profile": {
      "type": "object",
      "additionalProperties": false,
      "required": ["profile_ref"],
      "properties": {
        "profile_ref": {"type": "string", "minLength": 1, "maxLength": 512},
        "profile_hash": {"type": ["string", "null"], "maxLength": 256}
      }
    },
    "placement": {
      "type": "object",
      "additionalProperties": false,
      "required": ["locality"],
      "properties": {
        "locality": {"type": "string", "enum": ["local", "peer", "remote", "hybrid"]},
        "placement_decision_id": {"type": ["string", "null"], "maxLength": 256},
        "hardware_profile_ref": {"type": ["string", "null"], "maxLength": 512},
        "device_class": {"type": ["string", "null"], "maxLength": 160},
        "service_id": {"type": ["string", "null"], "maxLength": 512},
        "remote_endpoint_class": {"type": ["string", "null"], "maxLength": 160}
      }
    },
    "model_descriptor_ref": {"type": ["string", "null"], "maxLength": 512},
    "attempt": {"type": "integer", "minimum": 1, "maximum": 100},
    "created_at": {"type": "string", "format": "date-time"}
  },
  "$defs": {
    "exactExport": {"type":"object","additionalProperties":false,
      "required":["selector","service_id","destination_class","descriptor_hash","adapter_id","operation_id","source_artifact_id","source_content_hash","purpose","sensitivity","max_size_bytes"],
      "properties":{
        "selector":{"type":"string","minLength":1,"maxLength":512},
        "service_id":{"type":"string","pattern":"^service://","maxLength":512},
        "destination_class":{"type":"string","minLength":1,"maxLength":128},
        "descriptor_hash":{"type":"string","pattern":"^sha256:[a-f0-9]{64}$"},
        "adapter_id":{"type":"string","minLength":1,"maxLength":256},
        "operation_id":{"type":"string","minLength":1,"maxLength":256},
        "source_artifact_id":{"type":"string","minLength":1,"maxLength":256},
        "source_content_hash":{"type":"string","pattern":"^sha256:[a-f0-9]{64}$"},
        "purpose":{"type":"string","minLength":1,"maxLength":256},
        "sensitivity":{"enum":["public","local","private","confidential","secret"]},
        "max_size_bytes":{"type":"integer","minimum":1,"maximum":8388608}
      }
    }
  }
}
