{
  "schema_version": "0.1",
  "binding_id": "binding-demo-import-table-attempt-1",
  "attempt_id": "attempt-demo-import-table-1",
  "task_id": "task-demo-001",
  "semantic_program_hash": "sha256:beac8904db84998c56eca183c0e979f99746da2cec916f58c600416ee5de3cbf",
  "registry_snapshot_id": "sha256:5b1e89c974f35a0f3e1e7040bbec8f2e44ea908eb9a12d313ecda40600c6ddbd",
  "ir_version": "0.1",
  "node_id": "import_table",
  "capability": "table.import@1",
  "capability_contract_hash": "sha256:b6ab9313d952be9ee69e1fa240f17032a7a71b2e15c5d413077ce106570710c6",
  "conformance_evidence_id": "evidence-demo-table-import-attempt-1",
  "provider_trust_source_id": "sha256:5555555555555555555555555555555555555555555555555555555555555555",
  "provider": {
    "id": "org.ainative.provider.table-import",
    "version": "0.1.0",
    "manifest_hash": "sha256:3333333333333333333333333333333333333333333333333333333333333333",
    "package_or_build_hash": "sha256:4444444444444444444444444444444444444444444444444444444444444444",
    "conformance_status": "declared"
  },
  "inputs": {
    "source": {
      "semantic_type": "artifact.table@1",
      "artifact_or_value_ref": "artifact://task/task-demo-001/input/source",
      "content_hash": "sha256:2222222222222222222222222222222222222222222222222222222222222222",
      "revision": null
    }
  },
  "outputs": {
    "table": {
      "semantic_type": "data.table@1",
      "allocation_ref": "allocation://task/task-demo-001/import_table/table"
    }
  },
  "policy_decision_refs": ["policy-decision-demo-import-table"],
  "authority": {
    "grant_refs": ["grant://task/task-demo-001/artifact-read-source"],
    "expires_at": "2026-09-15T01:00:00Z"
  },
  "execution_profile": {
    "profile_ref": "profile://P2/table-import-demo",
    "profile_hash": null
  },
  "placement": {
    "locality": "local",
    "placement_decision_id": null,
    "hardware_profile_ref": "hardware://local/demo-laptop",
    "device_class": "ordinary-laptop",
    "service_id": null,
    "remote_endpoint_class": null
  },
  "model_descriptor_ref": null,
  "attempt": 1,
  "created_at": "2026-09-15T00:10:00Z"
}
